{"timestamp": "2025-01-01T12:00:00Z", "vehicle_id": "GEOTAB-01", "position": {"lat": 48.85, "lon": 2.35, "altitude_m": 35.0, "heading_deg": 180.0}, "motion": {"speed_kph": 45.2}, "events": [{"type": "harsh_brake", "severity": "high", "start": "2025-01-01T12:00:10Z", "end": "2025-01-01T12:00:12Z"}], "source": {"provider": "geotab", "device_id": "DEVICE-9876", "ingest_timestamp": "2025-01-01T12:00:05Z"}}